{
  "protocol_version": "1.1",
  "job_id": "synthetic_job_1",
  "case_id": null,
  "image_id": "synthetic_fixture",
  "tool_id": "T1_OCR",
  "evidence_profile_id": "cpu_probe_v1",
  "cache_contract": {
    "contract_version": "1.1",
    "canonical_sha256": "aaaaaaaaaaaaaaaaaaaaaaaaaaaaaaaaaaaaaaaaaaaaaaaaaaaaaaaaaaaaaaaa",
    "canonicalizer_version": "canonical-v1",
    "tool_id": "T1_OCR",
    "model_bundle_sha256": "bbbbbbbbbbbbbbbbbbbbbbbbbbbbbbbbbbbbbbbbbbbbbbbbbbbbbbbbbbbbbbbb",
    "backend": {
      "implementation": "synthetic_fixture_no_model_called",
      "source_revision": "fixture-v1",
      "framework": "fixture",
      "framework_version": "0",
      "device": "cpu",
      "precision": "fp32",
      "environment_lock_sha256": "cccccccccccccccccccccccccccccccccccccccccccccccccccccccccccccccc"
    },
    "parameters": {
      "input_size": 640
    },
    "prompt_set_sha256": null,
    "adapter_version": "adapter-v1",
    "roi_policy_id": "full_frame_v1"
  },
  "cache_key": "77a7b76a31ab2e2128d36d22a3f8d5759c50fec42f1fc75acae1a86a85fa8c59",
  "canonical_path": "input/canonical.png",
  "status": "queued",
  "attempt": 1,
  "timeout_seconds": 600,
  "last_error": null
}
